{
  "schemaVersion": "1.0",
  "kind": "visual-synthetic-scale-lattice-declaration",
  "declarationId": "junior-instrument-scale-lattice-declaration",
  "caseId": "junior-instrument-scale",
  "subjectPack": "junior-physics-answer",
  "fixtureKind": "synthetic_fixture",
  "dataClassification": {
    "level": "public",
    "containsPersonalData": false
  },
  "axis": "horizontal",
  "coordinateMetric": "inclusive_bbox_center_doubled_pixels",
  "pointerComponentRef": "scale-component-001",
  "majorTickComponentRefs": [
    "scale-component-002",
    "scale-component-003",
    "scale-component-004",
    "scale-component-005",
    "scale-component-006"
  ],
  "subdivisionsPerMajorInterval": 5,
  "minorTickSlots": [
    {
      "regionRef": "region-008",
      "slotIndex": 1
    },
    {
      "regionRef": "region-009",
      "slotIndex": 2
    },
    {
      "regionRef": "region-010",
      "slotIndex": 3
    },
    {
      "regionRef": "region-011",
      "slotIndex": 4
    },
    {
      "regionRef": "region-012",
      "slotIndex": 6
    },
    {
      "regionRef": "region-013",
      "slotIndex": 7
    },
    {
      "regionRef": "region-014",
      "slotIndex": 8
    },
    {
      "regionRef": "region-015",
      "slotIndex": 9
    },
    {
      "regionRef": "region-016",
      "slotIndex": 12
    },
    {
      "regionRef": "region-017",
      "slotIndex": 13
    },
    {
      "regionRef": "region-018",
      "slotIndex": 14
    },
    {
      "regionRef": "region-019",
      "slotIndex": 16
    },
    {
      "regionRef": "region-020",
      "slotIndex": 17
    },
    {
      "regionRef": "region-021",
      "slotIndex": 18
    },
    {
      "regionRef": "region-022",
      "slotIndex": 19
    }
  ],
  "geometryToleranceDoubledPixels": 1,
  "authorityProvenance": {
    "authorityKind": "explicit_synthetic_scale_lattice_declaration",
    "inferencePerformed": false,
    "liveProvider": false,
    "cloudEgress": false
  },
  "generatedAt": "2026-07-31T14:00:00Z"
}
